título,organismo,creado,actualizado,sector,idioma,coberturageográfica,frecuenciadeactualización,urldocumentacion,urlnormativa,descargas,visitas,clasificación,url
Perimetro municipal Cali,Departamento Administrativo de Planeación Municipal,2020-12-14T22:36:12.555053,2021-05-11T15:16:59.344647,Ordenamiento Territorial,Español,Local,No aplica,No aplica,No aplica,7,22,1,http://datos.cali.gov.co/dataset/perimetro-municipal-cali
Red de Nivelación de Cali,Departamento Administrativo de Planeación Municipal,2020-12-31T03:02:29.348618,2021-05-11T15:16:17.899151,Ordenamiento Territorial,Español,Local,No aplica,https://www.cali.gov.co/planeacion/publicaciones/46691/servicios_wms_idesc/,No aplica,3,12,5,http://datos.cali.gov.co/dataset/red-de-nivelacion-de-cali
Parque automotor activo en Santiago de Cali,Secretaría de Movilidad,2018-10-31T14:24:48.557049,2021-05-03T21:22:39.797121,Organismos de Control,Español,Local,Anual,No aplica,No aplica,118,173,4.5,http://datos.cali.gov.co/dataset/parque-automotor-activo
"Mortalidad en Santiago de Cali, en evento de tránsito según mes.",Secretaría de Movilidad,2018-10-31T14:42:15.511854,2021-05-03T17:42:43.233033,Movilidad,Español,Local,Anual,No aplica,No aplica,57,78,3.5,http://datos.cali.gov.co/dataset/mortalidad-en-evento-de-transito-segun-mes
"Mortalidad en eventos de tránsito en Santiago de Cali, según día del hecho.",Secretaría de Movilidad,2018-10-31T14:45:26.425882,2021-05-03T17:06:09.791619,Movilidad,Español,Local,Anual,No aplica,No aplica,49,71,3,http://datos.cali.gov.co/dataset/mortalidad-en-eventos-de-transito-segun-dia-del-hecho
Beneficiarios programa Más Vitales en Cali año 2019,Secretaria del Deporte y la Recreación,2020-12-04T14:05:00.678179,2021-05-03T12:36:25.929222,Deporte y Recreación,Español,Municipal/Distrital,Anual,https://www.cali.gov.co/deportes/publicaciones/154134/mas-vitales/,No aplica,22,60,4,http://datos.cali.gov.co/dataset/beneficiarios-programa-mas-vitales-en-cali
Horarios y Puntos de atención de programa Deporvida en Cali,Secretaria del Deporte y la Recreación,2019-04-12T17:00:36.135545,2021-05-03T12:34:03.396737,Deporte y Recreación,Español,Local,Semestral,No aplica,No aplica,91,225,4,http://datos.cali.gov.co/dataset/horarios-y-puntos-de-atencion-programa-deporvida
Horarios y puntos de atención programa Vértigo año 2019,Secretaria del Deporte y la Recreación,2019-04-12T14:28:15.464780,2021-05-03T12:29:28.867534,Deporte y Recreación,Español,Local,Anual,No aplica,No aplica,97,246,4,http://datos.cali.gov.co/dataset/horarios-y-puntos-de-atencion-programa-vertigo
Horario y puntos de atención programa cuerpo y espíritu año 2019,Secretaria del Deporte y la Recreación,2018-12-13T15:53:10.650161,2021-05-03T12:17:31.041928,Deporte y Recreación,Español,Local,Anual,No aplica,No aplica,151,1184,5,http://datos.cali.gov.co/dataset/horario-y-puntos-de-atencion-programa-cuerpo-y-espiritu
Escenarios Deportivos de Santiago de Cali,Secretaria del Deporte y la Recreación,2018-10-31T19:55:20.047162,2021-05-03T12:11:04.216607,Deporte y Recreación,Español,Local,Anual,No aplica,No aplica,144,192,4.5,http://datos.cali.gov.co/dataset/escenarios-deportivos-de-santiago-de-cali
Horarios y puntos de atención programa Calintegra en Cali año 2019,Secretaria del Deporte y la Recreación,2019-08-01T00:19:17.271018,2021-05-03T12:08:13.192281,Deporte y Recreación,Español,Municipal/Distrital,Semestral,No aplica,No aplica,40,101,5,http://datos.cali.gov.co/dataset/horarios-y-puntos-de-atencion-programa-calintegra-en-cali
Horarios y puntos de atención programa deporte comunitario de Cali año 2019,Secretaria del Deporte y la Recreación,2019-08-01T00:07:46.342444,2021-05-03T12:00:47.247582,Deporte y Recreación,Español,Municipal/Distrital,Semestral,No aplica,No aplica,47,204,3,http://datos.cali.gov.co/dataset/horarios-y-puntos-de-atencion-programa-deporte-comunitario-de-cali
Horarios y puntos de atención programa Carreras y Caminatas en Cali año 2019,Secretaria del Deporte y la Recreación,2019-07-31T15:54:34.182970,2021-05-03T11:59:50.136826,Deporte y Recreación,Español,Municipal/Distrital,Semestral,No aplica,No aplica,61,231,5,http://datos.cali.gov.co/dataset/horarios-y-puntos-de-atencion-programa-carreras-y-caminatas-en-cali
Horarios y puntos de atención programa Deporte Asociado de Cali año 2019,Secretaria del Deporte y la Recreación,2019-07-31T22:37:23.190187,2021-05-03T11:58:39.233843,Deporte y Recreación,Español,Municipal/Distrital,Semestral,No aplica,No aplica,30,54,5,http://datos.cali.gov.co/dataset/horarios-y-puntos-de-atencion-programa-deporte-asociado-de-cali
Horarios y puntos de atención programa Canas y Ganas de Cali año 2019,Secretaria del Deporte y la Recreación,2019-07-31T23:15:08.216747,2021-05-03T11:54:25.790106,Deporte y Recreación,Español,Municipal/Distrital,Semestral,No aplica,No aplica,34,114,4.5,http://datos.cali.gov.co/dataset/horarios-y-puntos-de-atencion-programa-canas-y-ganas-de-cali
Casos de muertes por eventos de tránsito en Santiago de Cali,Secretaría de Movilidad,2018-10-31T14:51:38.908428,2021-04-30T17:32:18.725020,Movilidad,Español,Municipal/Distrital,Anual,No aplica,No aplica,91,126,5,http://datos.cali.gov.co/dataset/casos-de-muertes-por-eventos-de-transito
Establecimientos e instituciones que manejan residuos hospitalarios cumpliendo las normas sanitarias en la ciudad de Cali.,Secretaría de Salud Pública,2018-10-31T15:39:03.627726,2021-04-29T00:22:28.268741,Salud y Protección Social,Español,Local,Anual,No aplica,No aplica,17,50,5,http://datos.cali.gov.co/dataset/instituciones-manejan-residuos-hospitalarios-cumpliendo-normas-sanitarias-ciudad-cali
Establecimientos e instituciones de concentración masiva que cumplen con manejo sanitario de los residuos sólidos comunes en la ciudad de Cali.,Secretaría de Salud Pública,2018-10-31T15:35:54.964749,2021-04-29T00:13:59.524662,Salud y Protección Social,Español,Local,Anual,No aplica,No aplica,21,51,4,http://datos.cali.gov.co/dataset/concentracion-masiva-cumplen-manejo-sanitario-residuos-solidos-comunes-ciudad-de-cali
Establecimientos Públicos con instalaciones locativas cumpliendo las normas sanitarias en la ciudad de Cali.,Secretaría de Salud Pública,2019-03-26T15:32:06.726683,2021-04-29T00:10:50.138117,Salud y Protección Social,Español,Local,Anual,No aplica,No aplica,39,158,4.5,http://datos.cali.gov.co/dataset/establecimientos-publicos-con-instalaciones-locativas-cumpliendo-las-normas-sanitarias
Indices Entomológicos en Sumideros del Programa prevención y control Enfermedades Transmitidas por Vectores - ETV,Secretaría de Salud Pública,2018-10-31T16:21:19.635939,2021-04-28T23:20:27.778687,Salud y Protección Social,Español,Local,Anual,No aplica,No aplica,99,130,5,http://datos.cali.gov.co/dataset/indices-entomologicos-en-sumideros
Sistema de Vigilancia Centinela de hospitalizaciones en menores hasta 5 años del Grupo de Salud Ambiental,Secretaría de Salud Pública,2018-10-31T15:55:52.697237,2021-04-28T23:06:37.476681,Salud y Protección Social,Español,Local,Anual,No aplica,No aplica,67,167,3.5,http://datos.cali.gov.co/dataset/centinela-de-hospitalizaciones-menores-hasta-5-anos-grupo-salud-ambiental
Afiliados al régimen subsidiado género masculino por grupos de edad,Secretaría de Salud Pública,2019-05-27T21:32:29.383856,2021-04-28T14:59:34.614675,Salud y Protección Social,Español,Local,Anual,No aplica,No aplica,24,34,5,http://datos.cali.gov.co/dataset/afiliados-al-regimen-subsidiado-genero-masculino-por-grupos-de-edad
Parques de Territorios de Inclusión y Oportunidades intervenidos con recursos propios,Secretaría de Desarrollo Territorial y Participación Ciudadana,2019-09-05T20:50:57.076087,2021-04-27T12:39:57.749623,Inclusión Social y Reconciliación,Español,Local,No aplica,No aplica,No aplica,35,76,4.5,http://datos.cali.gov.co/dataset/parques-de-territorios-de-inclusion-y-oportunidades-intervenidos-con-recursos-propios
Censo arbóreo de Santiago de Cali,Departamento Administrativo de Gestión del Medio Ambiente,2019-03-29T22:57:37.610187,2021-04-26T17:16:20.695043,Agricultura y desarrollo Rural,Español,Local,No aplica,No aplica,No aplica,4268,3727,4.3299999,http://datos.cali.gov.co/dataset/censo-arboreo-de-santiago-de-cali
Mapa de ruido semana diurno de Santiago de Cali,Departamento Administrativo de Gestión del Medio Ambiente,2018-10-28T19:08:41.082466,2021-04-26T17:15:21.726112,Ambiente y Desarrollo Sostenible,Español,Local,Trienio,http://www.sisaire.gov.co:8080/faces/docsInfoRuido/29-3-2016-11-11-18-522-1-0DOCUMENTO_MAPA_DE_RUIDO_2015.pdf,http://www.minambiente.gov.co/images/AsuntosambientalesySectorialyUrbana/pdf/emisiones_atmosfericas_contaminantes/norma_ruido/Resolucion_627_de_2006_-_Norma_nacional_de_emision_de_ruido.pdf,100,158,5,http://datos.cali.gov.co/dataset/mapa-de-ruido-semana-diurno-de-santiago-de-cali-ano-2015
Individuos vegetales producidos por el vivero municipal para siembras en Santiago de Cali,Departamento Administrativo de Gestión del Medio Ambiente,2019-10-31T17:33:56.803846,2021-04-26T17:13:31.963577,Ambiente y Desarrollo Sostenible,Español,Local,Anual,No aplica,No aplica,47,73,4,http://datos.cali.gov.co/dataset/siembras_cali
Mapa de ruido fin de semana diurno de Santiago de Cali,Departamento Administrativo de Gestión del Medio Ambiente,2018-10-28T19:05:36.916033,2021-04-26T17:12:32.394559,Ambiente y Desarrollo Sostenible,Español,Local,Trienio,http://www.sisaire.gov.co:8080/faces/docsInfoRuido/29-3-2016-11-11-18-522-1-0DOCUMENTO_MAPA_DE_RUIDO_2015.pdf,http://www.minambiente.gov.co/images/AsuntosambientalesySectorialyUrbana/pdf/emisiones_atmosfericas_contaminantes/norma_ruido/Resolucion_627_de_2006_-_Norma_nacional_de_emision_de_ruido.pdf,26,52,2,http://datos.cali.gov.co/dataset/mapa-de-ruido-fin-de-semana-diurno-de-santiago-de-cali-ano-2015
Mapa de ruido fin de semana nocturno en Santiago de Cali,Departamento Administrativo de Gestión del Medio Ambiente,2018-10-28T19:03:44.863388,2021-04-26T17:10:07.648051,Ambiente y Desarrollo Sostenible,Español,Local,No aplica,http://www.sisaire.gov.co:8080/faces/docsInfoRuido/29-3-2016-11-11-18-522-1-0DOCUMENTO_MAPA_DE_RUIDO_2015.pdf,http://www.minambiente.gov.co/images/AsuntosambientalesySectorialyUrbana/pdf/emisiones_atmosfericas_contaminantes/norma_ruido/Resolucion_627_de_2006_-_Norma_nacional_de_emision_de_ruido.pdf,79,99,4,http://datos.cali.gov.co/dataset/mapa-de-ruido-fin-de-semana-nocturno-en-santiago-de-cali-ano-2015
"Costos por evaluación y seguimiento para tala, poda, reubicación o traslado de árboles en predios privados, en Santiago de Cali 2016",Departamento Administrativo de Gestión del Medio Ambiente,2018-11-29T22:48:48.734840,2021-04-26T17:07:41.663918,Ambiente y Desarrollo Sostenible,Español,Local,Anual,No aplica,No aplica,43,123,3.5,http://datos.cali.gov.co/dataset/costos-evaluacion-seguimiento-tala-poda-arboles-predios-privados-santiago-de-cali-2016
Datos de calidad del aire en la estación La Flora en Santiago de Cali,Departamento Administrativo de Gestión del Medio Ambiente,2018-10-28T19:15:44.217431,2021-04-26T17:06:13.339795,Ambiente y Desarrollo Sostenible,Español,Local,Anual,No aplica,No aplica,117,264,5,http://datos.cali.gov.co/dataset/datos-de-calidad-del-aire-en-la-estacion-la-flora-2010-a-2018-en-santiago-de-cali
Datos de calidad del aire en la estación Escuela Republica de Argentina en Santiago de Cali,Departamento Administrativo de Gestión del Medio Ambiente,2018-11-30T15:26:11.283873,2021-04-26T17:04:20.661443,Ambiente y Desarrollo Sostenible,Español,Local,Anual,No aplica,No aplica,32,91,4.5,http://datos.cali.gov.co/dataset/calidad-del-aire-en-la-estacion-escuela-republica-de-argentina-2010-a-2018
Datos de ruido ambiental en Santiago de Cali,Departamento Administrativo de Gestión del Medio Ambiente,2019-09-09T23:01:38.260299,2021-04-26T17:03:01.714601,Ambiente y Desarrollo Sostenible,Español,Municipal/Distrital,Anual,No aplica,http://www.minambiente.gov.co/images/AsuntosambientalesySectorialyUrbana/pdf/emisiones_atmosfericas_contaminantes/norma_ruido/Resolucion_627_de_2006_-_Norma_nacional_de_emision_de_ruido.pdf,69,118,5,http://datos.cali.gov.co/dataset/datos-de-ruido-ambiental-en-santiago-de-cali
Datos de calidad del aire en la estación Transitoria en Santiago de Cali,Departamento Administrativo de Gestión del Medio Ambiente,2019-04-01T23:18:13.138169,2021-04-26T17:02:03.021906,Ambiente y Desarrollo Sostenible,Español,Municipal/Distrital,Anual,No aplica,No aplica,34,100,1,http://datos.cali.gov.co/dataset/datos-de-calidad-del-aire-en-la-estacion-transitoria-en-santiago-de-cali
Arboles notables en Santiago de Cali,Departamento Administrativo de Gestión del Medio Ambiente,2018-10-29T01:09:47.277652,2021-04-26T16:05:49.788578,Ambiente y Desarrollo Sostenible,Español,Local,No aplica,No aplica,No aplica,600,945,4.3299999,http://datos.cali.gov.co/dataset/arboles-notables-en-santiago-de-cali
Datos de calidad del aire en la estación Cañaveralejo en Santiago de Cali,Departamento Administrativo de Gestión del Medio Ambiente,2018-10-28T19:19:31.798165,2021-04-26T16:04:32.359309,Ambiente y Desarrollo Sostenible,Español,Local,Anual,No aplica,No aplica,84,162,4,http://datos.cali.gov.co/dataset/datos-de-calidad-del-aire-en-la-estacion-canaveralejo-2014-a-2019-en-santiago-de-cali
Datos de calidad del aire en la estación La Ermita en Santiago de Cali,Departamento Administrativo de Gestión del Medio Ambiente,2018-10-29T00:49:03.951488,2021-04-26T15:46:02.852724,Ambiente y Desarrollo Sostenible,Español,Local,Anual,No aplica,No aplica,74,181,4.3299999,http://datos.cali.gov.co/dataset/datos-de-calidad-del-aire-en-la-estacion-la-ermita-2013-a-2020-en-santiago-de-cali
Indice de calidad del aire (ICA) de Santiago de Cali,Departamento Administrativo de Gestión del Medio Ambiente,2018-10-29T01:08:32.540131,2021-04-26T15:43:51.828607,Ambiente y Desarrollo Sostenible,Español,Local,Anual,http://www.cali.gov.co/dagma/publicaciones/38365/sistema_de_vigilancia_de_calidad_del_aire_de_cali_svcac/,http://www.minambiente.gov.co/index.php/asuntos-ambientales-sectorial-y-urbana/gestion-del-aire/contaminacion-atmosferica#1-1-normativa,150,392,4,http://datos.cali.gov.co/dataset/indice-de-calidad-del-aire-ica-de-santiago-de-cali
EVENTOS TEATRINO 2020,Unidad Administrativa Especial Teatro Municipal,2021-04-18T23:10:04.069895,2021-04-18T23:11:29.098058,Cultura,Español,Local,No aplica,No aplica,No aplica,9,16,2,http://datos.cali.gov.co/dataset/eventos-teatrino-2020
EVENTOS SALA PRINCIPAL 2020,Unidad Administrativa Especial Teatro Municipal,2021-04-18T23:05:14.218791,2021-04-18T23:06:01.983229,Cultura,Español,Local,No aplica,No aplica,No aplica,7,19,1,http://datos.cali.gov.co/dataset/eventos-sala-principal-2020
Inspecciones de policia especiales del municipio de Santiago de Cali 2020,Secretaría de Seguridad y Justicia,2018-10-31T17:28:15.232113,2021-04-18T22:21:37.337494,Agricultura y desarrollo Rural,Español,Local,Anual,No aplica,No aplica,52,38,5,http://datos.cali.gov.co/dataset/inspecciones-de-policia-especiales-del-municipio-de-santiago-de-cali-2020
Inspecciones de policía rural 2020,Secretaría de Seguridad y Justicia,2018-10-31T17:45:15.487442,2021-04-18T22:19:06.114285,Agricultura y desarrollo Rural,Español,Local,Anual,No aplica,No aplica,18,36,2,http://datos.cali.gov.co/dataset/inspecciones-de-policia-rural-2020
Afiliados al régimen subsidiado género femenino por grupos de edad,Secretaría de Salud Pública,2019-05-27T20:40:50.726399,2021-04-16T22:02:48.305219,Salud y Protección Social,Español,Local,Anual,No aplica,No aplica,28,32,5,http://datos.cali.gov.co/dataset/afiliados-al-regimen-subsidiado-genero-femenino-por-grupos-de-edad
Afiliados al régimen contributivo género femenino por grupos de edad,Secretaría de Salud Pública,2019-05-31T16:55:32.320553,2021-04-16T21:46:37.451109,Salud y Protección Social,Español,Local,Anual,No aplica,No aplica,41,46,4,http://datos.cali.gov.co/dataset/afiliados-al-regimen-contributivo-genero-femenino-por-grupos-de-edad
Homicidios según tipo de sexo por año,Secretaría de Seguridad y Justicia,2019-08-27T20:45:31.740649,2021-04-16T21:20:33.957283,Estadísticas,Español,Local,Anual,No aplica,No aplica,27,42,3,http://datos.cali.gov.co/dataset/homicidios-segun-tipo-de-sexo-por-ano
Suicidios según tipo de sexo por año.,Secretaría de Seguridad y Justicia,2019-08-28T02:44:32.487891,2021-04-16T21:17:57.186029,Seguridad y Justicia/ Paz /Cultura Ciudadana,Español,Municipal/Distrital,Anual,No aplica,No aplica,8,13,1,http://datos.cali.gov.co/dataset/suicidios-segun-tipo-de-sexo-por-ano
Eventos de violencia de género en Santiago de Cali,Secretaría de Salud Pública,2018-10-31T15:21:33.519157,2021-04-16T21:16:56.706244,Salud y Protección Social,Español,Local,Anual,No aplica,No aplica,149,182,5,http://datos.cali.gov.co/dataset/eventos-de-violencia-de-genero-en-santiago-de-cali
Quejas disciplinarias recibidas por año y tiempo valoración en Cali,Departamento Administrativo de Control Disciplinario Interno,2018-10-28T18:44:28.856139,2021-04-14T17:18:59.752208,Organismos de Control,Español,Local,Anual,No aplica,No aplica,65,130,1,http://datos.cali.gov.co/dataset/quejas-disciplinarias-recibidas-por-ano-y-tiempo-valoracion-en-cali
Número de personas orientadas en código disciplinario único en Cali,Departamento Administrativo de Control Disciplinario Interno,2018-10-28T18:37:42.470547,2021-04-14T17:07:37.702014,Gestión Pública/Administrativa,Español,Local,Anual,No aplica,No aplica,41,94,4.5,http://datos.cali.gov.co/dataset/numero-de-personas-orientadas-en-codigo-disciplinario-unico-en-cali
Planes parciales con tratamiento de desarrollo para VIS y VIP año 2015 - 2016 cali,Departamento Administrativo de Planeación Municipal,2019-08-05T15:18:04.715534,2021-03-30T16:12:41.569865,Ordenamiento Territorial,Español,Municipal/Distrital,Anual,No aplica,No aplica,17,37,3,http://datos.cali.gov.co/dataset/planes-parciales-con-tratamiento-de-desarrollo-para-vis-y-vip-ano-2015-2016-cali
Permisos de publicidad móvil en Cali,Departamento Administrativo de Planeación Municipal,2018-11-23T19:31:54.749924,2021-03-30T16:10:31.025945,Agricultura y desarrollo Rural,Español,Local,Anual,https://planeacion.cali.gov.co/saul/automotores,No aplica,26,42,3,http://datos.cali.gov.co/dataset/permisosde-publicidad-movil
Población afiliada al Régimen contributivo en Santiago de Cali,Secretaría de Salud Pública,2019-05-27T21:00:01.747974,2021-03-17T22:02:14.814386,Salud y Protección Social,Español,Local,Anual,No aplica,No aplica,79,70,5,http://datos.cali.gov.co/dataset/poblacion-afiliada-al-regimen-contributivo-en-santiago-de-cali
Población afiliada al Régimen subsidiado en Santiago de Cali,Secretaría de Salud Pública,2019-05-27T20:12:17.655914,2021-03-17T21:58:50.110489,Salud y Protección Social,Español,Local,Anual,No aplica,No aplica,50,60,3.5,http://datos.cali.gov.co/dataset/poblacion-afiliada-al-regimen-subsidiado-en-santiago-de-cali
Base de datos eventos Teatrino - Teatro Municipal Enrique Buenaventura 2019,Unidad Administrativa Especial Teatro Municipal,2020-11-09T04:16:30.483305,2021-03-17T21:44:44.166804,Cultura,Español,Local,Anual,No aplica,No aplica,12,22,3,http://datos.cali.gov.co/dataset/base-de-datos-eventos-sala-teatrino-teatro-municipal-2019
Base de datos eventos sala principal - Teatro Municipal Enrique Buenaventura 2019,Unidad Administrativa Especial Teatro Municipal,2020-11-09T04:07:45.965342,2021-03-17T21:33:49.999483,Cultura,Español,Local,Anual,No aplica,No aplica,17,24,4.5,http://datos.cali.gov.co/dataset/base-de-datos-eventos-sala-principal-teatro-municipal-2019
Información Histórica de Predios de Santiago de Cali,Departamento Administrativo de Hacienda Municipal,2019-11-25T21:23:49.827769,2021-03-11T19:53:41.111325,Infraestructura y Catastro,Español,Municipal/Distrital,Anual,No aplica,No aplica,263,365,5,http://datos.cali.gov.co/dataset/informacion-historica-de-predios-de-santiago-de-cali
Datasets publicados por la Alcaldía de Cali,Secretaría de Gobierno,2018-10-31T13:34:06.900413,2021-03-03T14:55:39.492874,Participación Ciudadana,Español,Municipal/Distrital,Anual,No aplica,No aplica,174,410,5,http://datos.cali.gov.co/dataset/datasets-publicados-por-la-alcaldia-de-cali
Edificaciones Certificadas en Ascensores del  2019 al 2020,Secretaría de Gestión del Riesgo de Emergencias y Desastres,2020-12-31T22:29:59.545571,2020-12-31T22:30:20.301295,Agricultura y desarrollo Rural,Español,Local,Anual,No aplica,No aplica,9,19,4,http://datos.cali.gov.co/dataset/edificaciones-certificadas-en-ascensores-del-2019-al-2020
Visitas a Sistemas de Transporte Vertical y Puertas Electricas realizadas en Cali del 2019 al 2020,Secretaría de Gestión del Riesgo de Emergencias y Desastres,2020-12-31T22:18:16.134918,2020-12-31T22:21:13.958820,Ciencia Tecnología e Innovación,Español,Local,Anual,No aplica,No aplica,3,18,2,http://datos.cali.gov.co/dataset/visitas-a-sistemas-de-transporte-vertical-y-puertas-electricas-realizadas-en-cali-del-2019-al-2020
Visitas realizadas en Cali por gestion del riesgo en el 2018 al 2020,Secretaría de Gestión del Riesgo de Emergencias y Desastres,2018-10-30T22:26:08.541592,2020-12-31T21:59:40.344386,Agricultura y desarrollo Rural,Español,Local,Anual,No aplica,No aplica,25,63,1,http://datos.cali.gov.co/dataset/visitas_realizadas_en_cali_por_gestion_del_riesgo_en_el_2018_al_2020
Incidentes en Cali atendidos por los bomberos 2018 al 2020,Secretaría de Gestión del Riesgo de Emergencias y Desastres,2018-10-30T22:21:55.100518,2020-12-31T21:52:51.344737,Agricultura y desarrollo Rural,Español,Local,Anual,No aplica,No aplica,40,73,1,http://datos.cali.gov.co/dataset/incidentes_en-cali_atendidos_por_lo_bomberos_2018_al_2020
Puestos unificados realizados por gestion del riesgo en Cali 2018 al 2020,Secretaría de Gestión del Riesgo de Emergencias y Desastres,2018-10-30T22:24:32.818305,2020-12-31T21:43:55.018627,Agricultura y desarrollo Rural,Español,Local,Anual,No aplica,No aplica,13,33,1,http://datos.cali.gov.co/dataset/puestos-unificados-realizados-por-gestion-del-riesgo-en-cali-2018-al-2020
Capacitaciones comunitarias en Cali 2018 al 2020,Secretaría de Gestión del Riesgo de Emergencias y Desastres,2018-10-30T22:00:27.382526,2020-12-31T21:14:43.030712,Salud y Protección Social,Español,Local,Anual,No aplica,No aplica,30,59,5,http://datos.cali.gov.co/dataset/capacitaciones_comunitarias_en_cali_2018_al_2020
Pactos para la reapertura económica y social,Secretaría de Gobierno,2020-12-29T17:37:03.629023,2020-12-29T17:57:51.379832,"Económica, Industria y Comercio",Español,Local,No aplica,No aplica,No aplica,21,35,1,http://datos.cali.gov.co/dataset/pactos-para-la-reapertura-economica-y-social
Expediciones territoriales Guardianes de Vida,Secretaría de Gobierno,2020-12-29T16:23:13.208881,2020-12-29T17:22:50.684429,Participación Ciudadana,Español,Local,No aplica,https://guardianesdevida.cali.gov.co/escuela/,No aplica,36,42,1,http://datos.cali.gov.co/dataset/expediciones-territoriales-guardianes-de-vida
Casos de barreras de atención frente a servicios de salud en Santiago de Cali,Secretaría de Salud Pública,2020-12-29T13:08:07.186086,2020-12-29T13:50:13.773309,Salud y Protección Social,Español,Local,Anual,No aplica,No aplica,7,18,4.5,http://datos.cali.gov.co/dataset/casos-de-barreras-de-atencion-frente-a-servicios-de-salud-en-santiago-de-cali
Premios otorgados a la Alcaldía de Cali,Secretaría de Gobierno,2019-10-04T20:21:07.576346,2020-12-28T16:07:59.712521,Gestión Pública/Administrativa,Español,Municipal/Distrital,Anual,No aplica,No aplica,72,150,4.5,http://datos.cali.gov.co/dataset/premios-otorgados-a-la-alcaldia-de-cali
Terrenos estabilizados en Cali por la Secretaría de Vivienda Social y Hábitat para Mitigación de Riesgos,Secretaría de Vivienda Social y Hábitat,2020-12-27T02:50:54.669594,2020-12-27T16:29:59.060609,Vivienda y Hábitat,Español,Local,Anual,No aplica,No aplica,16,43,2,http://datos.cali.gov.co/dataset/terrenos-estabilizados-en-cali-por-la-secretaria-de-vivienda-social-y-habitat
Consumo de Sustancias Psicoactivas (SPA) en Santiago de cali,Secretaría de Salud Pública,2019-12-23T18:25:47.671132,2020-12-17T22:05:05.452608,Salud y Protección Social,Español,Local,No aplica,No aplica,No aplica,98,133,5,http://datos.cali.gov.co/dataset/consumo-de-sustancias-psicoactivas-spa-en-santiago-de-cali
Servicios prestados en los Centros de Administración Local Integrada - CALI,Secretaría de Desarrollo Territorial y Participación Ciudadana,2020-12-16T14:21:19.973882,2020-12-16T15:02:37.379634,Social / Población,Español,Municipal/Distrital,Anual,No aplica,No aplica,17,34,2,http://datos.cali.gov.co/dataset/servicios-prestados-en-los-centros-de-administracion-local-integrada-cali
Llamadas de Urgencias y Emergencias que ingresan a través de la Linea 123 de Santiago de Cali,Secretaría de Salud Pública,2020-08-21T18:21:40.392744,2020-12-02T14:12:52.744163,Salud y Protección Social,Español,Local,No aplica,No aplica,No aplica,46,66,3,http://datos.cali.gov.co/dataset/llamadas-de-urgencias-y-emergencias-que-ingresan-a-traves-de-la-linea-123-de-santiago-de-cali
Subsidio en el componente de aseo  2017 al 2020 Cali,Unidad Administrativa Especial de Servicios Públicos Municipales,2020-12-01T01:10:29.418862,2020-12-01T01:11:18.124699,Ambiente y Desarrollo Sostenible,Español,Municipal/Distrital,Anual,No aplica,No aplica,3,12,5,http://datos.cali.gov.co/dataset/subsidio-en-el-componente-de-aseo-2017-al-2020-cali
Juntas Administradoras Locales de Santiago de Cali,Secretaría de Desarrollo Territorial y Participación Ciudadana,2019-07-31T20:11:07.956457,2020-11-25T16:25:51.002805,Participación Ciudadana,Español,Municipal/Distrital,Anual,No aplica,No aplica,690,246,4,http://datos.cali.gov.co/dataset/juntas-administradoras-locales-de-santiago-de-cali
